code,grouping,title,description
af,,Artificial fill (late Holocene),Man-made deposits of varying composition.
Qb,,Beach deposits (Holocene),"Moderately sorted, fine- to very coarse-grained to gravelly arkosic sand."
Qfp,,Flood-plain deposits (Holocene),Gravelly to silty sand and sandy to clayey silt. Locally includes lacustrine and delta deposits. In part may be Pleistocene.
Qt,,Talus deposits (Holocene),Accumulations of coarse angular blocks to gravelly and sandy granitic and volcanic debris. In part may be Pleistocene. Extensive deposits along the Truckee River.
Ql,,Lake deposits (Holocene),Thin-bedded sandy silt and clay.
Qyg,,Younger glacial deposits (Holocene),"Unsorted sandy to clayey, boulder to cobble till; forms undissected moraines. Locally may include talus and alluvial fan deposits."
Qc,,Colluvium (Holocene),"Unsorted, poorly consolidated granitic colluvium, decomposed granite, soil, matrix supported debris flow material, sand and cobble to boulder gravel."
Qls,,Landslide deposits (Holocene and Pleistocene),"Unsorted angular boulder- to clay- size debris; locally may include talus, colluvium, rockfall and avalanche deposits. Includes accumulations of poorly sorted, disrupted materials transported by debris flows."
Q,,Alluvium (Holocene and Pleistocene),"Unconsolidated, moderately to poorly sorted sand, silt and gravel. Locally includes alluvial fan deposits, glacial outwash and lacustrine deposits."
Qf,,Alluvial fan deposits (Holocene and Pleistocene),Poorly sorted bouldery sand and gravel. Locally includes older fan deposits and alluvium.
Qm,,Mudflow deposits of Birkeland (1961) (Holocene and (or) Pleistocene),Cobbles and boulders of local bedrock in a mud matrix deposited as a debris flow or flows at the confluence of Deer Creek and the Truckee River.
Qob,,Older beach deposits (Pleistocene),"Moderately sorted gravelly, coarse arkosic sand in the South Lake Tahoe quadrangle."
Qol,,Older lake deposits (Pleistocene),Thin-bedded sandy silt and clay.
Qlt,,Lacustrine terrace deposits (Pleistocene),"Poorly to moderately sorted silt, sand and gravel forming broad low terraces 5-10 meters above lake level. Locally includes delta deposits."
Qti,,Till of the Tioga glacial deposits (Pleistocene),"Approximate age 9,990 – 25,500 YBP (Yount and LaPointe, 1997). Unconsolidated, gray to light-tan, bouldery polymict till characterized by large granitic boulders, generally unweathered; preserved as sharp-crested moraines. Locally may include outwash deposits."
Qtio,,Outwash of the Tioga glacial deposits (Pleistocene),"Approximate age 9,990 – 25,500 YBP (Yount and LaPointe, 1997). Unconsolidated boulder and cobble gravel, sand and silt; generally unweathered."
Qta,,Till of the Tahoe glacial deposits (Pleistocene),"Approximate age 56,000 – 118,000 YBP (Yount and LaPointe, 1997). Unconsolidated bouldery till with distinct yellow-brown weathered matrix; preserved as larger moraines with more rounded and broader crests. Locally may include outwash deposits."
Qtao,,Outwash of the Tahoe glacial deposits (Pleistocene),"Approximate age 56,000 – 118,000 YBP (Yount and LaPointe, 1997). Unconsolidated polymict boulder to cobble gravel, sand and silt; distinguished from Tioga outwash deposits by higher terrace position and greater degree and depth of soil development."
Qgt,,Till of the Tahoe and Tioga glacial deposits – undivided (Pleistocene),"Unsorted to very poorly sorted, bouldery to clayey gravel; surface granitic boulders slightly to moderately weathered. Associated with undissected to moderately dissected moraines. Locally may include outwash deposits."
Qog,,Till of the Pre-Tahoe deposits (Pleistocene),"Includes Sherwin deposits of Birkeland (1961) and Donner Lake deposits of Harwood and Fisher (2002). Deeply weathered bouldery deposits generally without morainal form; surface granitic boulders are weathered with stained, pitted and knobby surface; granitic boulders within the deposit are decomposed. Locally may include outwash deposits."
Qogo,,Outwash of the Pre-Tahoe deposits (Pleistocene),"Includes Sherwin deposits of Birkeland (1961) and Donner Lake deposits of Harwood and Fisher (2002). Poorly sorted boulder and cobble gravel, sand and silt."
Qg,,Till of the glacial deposits undivided (Pleistocene and Holocene?),Includes Tioga and Tahoe age deposits as well as pre-Tahoe and possibly younger (Holocene) glacial deposits.
Qgo,,Outwash of the glacial deposits undivided (Pleistocene and Holocene?),"Includes Tioga and Tahoe age deposits as well as pre-Tahoe and possibly younger (Holocene) glacial deposits. Poorly sorted boulder and cobble gravel, sand and silt."
Qvbm,,Bald Mountain olivine latite of Birkeland (1961) (Pleistocene),"Dark-gray olivine latite flow erupted from vents at and southwest of Bald Mountain. Qvbmcc – cinder cone deposits. Includes olivine shoshonite flows, scoria and tuff of Latham (1985). K/Ar whole-rock age of 1.2±0.1 Ma (recalculated from Dalrymple, 1964)."
Qvbmcc,,Bald Mountain olivine latite of Birkeland (1961) (Pleistocene),cinder cone deposits
Qjf,,Juniper Flat alluvium of Birkeland (1961) (Pleistocene),"Interfingering lenses of silt, sand and gravel; gravel is mainly andesitic. Includes Union Valley sediments of Latham (1985)"
Qpc,,Prosser Creek alluvium of Birkeland (1961) (Pleistocene),"Indurated polymict boulder to pebble gravel, sand and silt; partly alluvial and partly lacustrine. Deposited when Truckee River drainage was blocked by Hirschdale olivine latite flows."
Qvh,,Hirschdale olivine latite of Birkeland (1961) (Pleistocene),"Dark-gray to dark- green porphyritic olivine latite flows containing pillow structures near base; erupted from vents near Juniper Flat. Qvhcc – cinder cone deposits, Qvht – basaltic tuff. Includes Juniper Flat flow of Latham (1985). K-Ar whole-rock age of 1.3±0.1 Ma (recalculated from Dalrymple, 1964)."
Qvhcc,,Hirschdale olivine latite of Birkeland (1961) (Pleistocene),Cinder cone deposits
Qvht,,Hirschdale olivine latite of Birkeland (1961) (Pleistocene),Basaltic tuff
QPot,,Older talus deposits (Pliocene and/or Pleistocene),"Moderately weathered, lichen-encrusted, bouldery deposits in the Mt. Tallac area. Interpreted to be the dissected remnants of a previous land surface (Fisher, 1989)."
QPvd,,Dry Lake volcanic flows of Birkeland (1961) and Wise and Sylvester (2004) (Pliocene and/or Pleistocene),"Consists of at least four aphyric and porphyritic flows of potassium-rich andesite and dacite from domes south and southeast of Dry Lake in the Martis Peak quadrangle. QPvd1 – QPv4 (oldest to youngest). A whole- rock age of 1.34 Ma is reported from a flow west of Klondike Meadow in the Martis Peak quadrangle (written communication, A.G. Sylvester, 2004). Birkeland (1961) originally mapped five latite and basalt flows; Latham (1985) mapped six hornblende and pyroxene andesite flows."
QPvd1,,Dry Lake volcanic flows of Birkeland (1961) and Wise and Sylvester (2004) (Pliocene and/or Pleistocene),"Aphyric and porphyritic flows of potassium-rich andesite and dacite from domes south and southeast of Dry Lake in the Martis Peak quadrangle. QPvd1 – QPv4 (oldest to youngest). A whole- rock age of 1.34 Ma is reported from a flow west of Klondike Meadow in the Martis Peak quadrangle (written communication, A.G. Sylvester, 2004). Birkeland (1961) originally mapped five latite and basalt flows; Latham (1985) mapped six hornblende and pyroxene andesite flows."
QPvd2,,Dry Lake volcanic flows of Birkeland (1961) and Wise and Sylvester (2004) (Pliocene and/or Pleistocene),"Aphyric and porphyritic flows of potassium-rich andesite and dacite from domes south and southeast of Dry Lake in the Martis Peak quadrangle. QPvd1 – QPv4 (oldest to youngest). A whole- rock age of 1.34 Ma is reported from a flow west of Klondike Meadow in the Martis Peak quadrangle (written communication, A.G. Sylvester, 2004). Birkeland (1961) originally mapped five latite and basalt flows; Latham (1985) mapped six hornblende and pyroxene andesite flows."
QPvd3,,Dry Lake volcanic flows of Birkeland (1961) and Wise and Sylvester (2004) (Pliocene and/or Pleistocene),"Aphyric and porphyritic flows of potassium-rich andesite and dacite from domes south and southeast of Dry Lake in the Martis Peak quadrangle. QPvd1 – QPv4 (oldest to youngest). A whole- rock age of 1.34 Ma is reported from a flow west of Klondike Meadow in the Martis Peak quadrangle (written communication, A.G. Sylvester, 2004). Birkeland (1961) originally mapped five latite and basalt flows; Latham (1985) mapped six hornblende and pyroxene andesite flows."
QPvd4,,Dry Lake volcanic flows of Birkeland (1961) and Wise and Sylvester (2004) (Pliocene and/or Pleistocene),"Aphyric and porphyritic flows of potassium-rich andesite and dacite from domes south and southeast of Dry Lake in the Martis Peak quadrangle. QPvd1 – QPv4 (oldest to youngest). A whole- rock age of 1.34 Ma is reported from a flow west of Klondike Meadow in the Martis Peak quadrangle (written communication, A.G. Sylvester, 2004). Birkeland (1961) originally mapped five latite and basalt flows; Latham (1985) mapped six hornblende and pyroxene andesite flows."
QPvbc,,Big Chief basalt of Birkeland (1961) (Pliocene and/or Pleistocene),Dark-gray hypocrystalline basalt with sparse olivine phenocrysts; probably erupted from fissures along northwest-trending faults. Deer Creek trachybasaltic andesite flow of Wise and Sylvester (2004).
QPvpm,,Page Meadow basalt of Wise and Sylvester (2004) (Pliocene and/or Pleistocene),Olivine basalt flows and dikes along south side of Truckee River and under Page Meadows. Also occurs as dikes in the Sunnyside area.
QPs,,"Unnamed gravels, sand and alluvium (Pliocene and/or Pleistocene)",Undivided gravels and alluvial deposits. Includes Cabin Creek alluvium of Birkeland (1961) in the Truckee quadrangle - weathered andesitic cobble gravel and interstitial andesitic sand overlain by the Bald Mountain flow. Also includes the Fir Crags gravel of Birkeland (1961) in the Tahoe City quadrangle - andesitic cobble gravel that underlies the Page Meadow basalt. Locally may include lacustrine deposits.
QPvbu,,Burton Creek basalt of Wise and Sylvester (2004) (Pliocene and/or Pleistocene),Olivine basalt flows south of Burton Creek.
QPvlf,,Lake Forest basalt of Wise and Sylvester (2004) (Pliocene and/or Pleistocene),Olivine basalt flows northwest of Lake Forest.
QPvb,,Unnamed volcanic rocks (Pliocene and/or Pleistocene),"Basalt flows, flow breccia and basaltic ash. Includes maar at Lake Forest near Dollar Point."
QPi,,Unnamed intrusive rocks (Pliocene and/or Pleistocene),"Irregular-shaped intrusions and dikes of andesite, latite and basalt. May include local flows. QPia – intrusive andesite and latite; QPib – intrusive basalt."
Pvta,,Tahoe City trachyandesite of Wise and Sylvester (2004) (Pliocene),Thick trachyandesite flows northwest of Tahoe City. Pvtcc - cinder cone deposits.
Pvtb,,Tahoe City basalt of Wise and Sylvester (2004) (Pliocene),"Dark-gray olivine basalt and palagonitic basalt flows with local pillow structures at the base; underlies Tahoe City and forms a bench along Truckee River. Tahoe City olivine latite of Birkeland (1961). K-Ar whole-rock age of 2.0±0.1 Ma (recalculated from Dalrymple, 1964)."
Pvp,,Polaris olivine latite of Birkeland (1961) (Pliocene),"Small olivine latite flow overlying latite tuff and tuff breccia. Pvpt – latite tuff and tuff breccia. K-Ar whole- rock age of 1.68±0.05 Ma (recalculated from Doell and others, 1966)."
Pvpt,,Polaris olivine latite of Birkeland (1961) (Pliocene),Latite tuff and tuff breccia
Pvah,,Alder Hill basalt of Birkeland (1961) (Pliocene),"Three olivine basalt flows probably erupted from vent on Alder Hill. Pvahcc - cinder cone deposits. Includes Alder Creek and Beacon flows of Latham (1985). K-Ar whole-rock age of 2.4±0.1 Ma (recalculated from Dalrymple, 1964)."
Pvahcc,,Alder Hill basalt of Birkeland (1961) (Pliocene),Cinder cone deposits
Pva,,Andesite and basaltic andesite flows (Pliocene),"Light- to dark-gray, fine-grained porphyritic, massive to locally flow-banded andesite and basaltic andesite flows. Occurs as continuous flows and isolated remnants of larger flows deposited in channels eroded in older Tertiary volcanic deposits. Includes lava domes in the Agate Bay area (Wise and Sylvester, 2004). Harwood and Fisher (2002) report K-Ar whole-rock ages that range from 3.3±0.09 to 4.7±0.1 Ma on andesite flows in the Homewood, Tahoe City, and adjacent quadrangles to the west. Basaltic andesite flows along the northwest corner of the Martis Peak quadrangle have been dated north of the map area in the Boca quadrangle. Samples at Boca Hill and from a flow to the north give Ar/Ar whole-rock ages of 4.09±0.40 Ma and 3.95±0.15 Ma respectively (written communication, C.D. Henry, 2004). K-Ar whole-rock ages of 2.3±0.1 Ma (recalculated from Dalrymple, 1964) on an upper andesite flow and 2.53±0.07 Ma (recalculated from Doell and others, 1966) on a lower andesite flow along the highway south of Watson Creek in the Kings Beach quadrangle."
Pval,,Andesite lahars (Pliocene),"Deposits of blocky, light- to dark-gray tuff breccia derived from and interbedded with hornblende- and hypersthene- bearing flows."
Pvb,,Basalt flows (Pliocene),"Dark-gray to black, fine-grained, sparsely porphyritic to glomeroporphyritic olivine basalt flows occurring as small, widely separated, columnar-jointed masses deposited on older Tertiary volcanic rocks and granitic rocks. K-Ar whole-rock ages on basalt flows, west of the map area, range from 7.6± 0.2 to 4.0±0.1 Ma (Harwood and Fisher, 2002). Includes the Boca Ridge flows of Latham (1985) - porphyritic olivine basaltic andesite, shoshonite, latite and mugearite flows. North of the map area, in the Boca quadrangle, Latham (1985) reports a K-Ar whole-rock age of 2.8 Ma on a flow north of Rocky Canyon on Boca Ridge. Henry and Perkins (2001) report an Ar/Ar whole-rock age of 2.61±0.03 Ma on the same basaltic andesite flow."
Pi,,Dikes and intrusives (Pliocene),"Pia - Flow-banded to massive, fine- to coarse- grained hornblende andesite dikes and altered intrusive andesite and andesite breccia in vent areas; Pib - Black, fine-grained olivine basalt dikes and intrusives. Harwood and Fisher (2002) report a K-Ar whole-rock age of 3.0±0.08 Ma on an andesite plug in the Ellis Peak area and 4.0±0.1 and 4.1±0.1 Ma ages on andesite dikes in the Ward Peak area. Andesite dikes, to the west of the map area, have K-Ar whole-rock ages that range from 3.6±0.05 to 4.3±0.1m.y (Harwood and Fisher, 2002). Basalt dikes, in the same area, have K-Ar whole-rock ages that range from 3.9±0.1 to 4.4±0.1 Ma (Harwood and Fisher, 2002)."
Pia,,Dikes and intrusives (Pliocene),"Flow-banded to massive, fine- to coarse-grained hornblende andesite dikes and altered intrusive andesite and andesite breccia in vent areas"
Pib,,Dikes and intrusives (Pliocene),"Black, fine-grained olivine basalt dikes and intrusives."
Mva,,"Undivided andesitic and dacitic lahars, flows, breccia and volcaniclastic sediments (Miocene)","Undivided andesite, trachyandesite, basaltic andesite and dacite lahars, flows, breccia and volcaniclastic sediments; local basalt flows. In part, may include rocks of Pliocene age. Locally includes rhyolite tuff. Includes Mehrten, Relief Peak and Kate Peak formations. An andesite block from a block and ash flow tuff west of Kirkwood Valley in the Caples Lake quadrangle gives a preliminary Ar/Ar plagioclase age of 6.0±0.2 Ma (DeOreo, 2004). An andesite block from a block and ash flow tuff east of Kirkwood Valley in the Caples Lake quadrangle gives an Ar/Ar biotite age of 14.70±0.06 Ma and a preliminary plagioclase age of 14.0±0.5Ma (DeOreo, 2004). An andesite peperite dike that intrudes debris flow deposits east of Kirkwood Valley in the Caples Lake quadrangle gives an Ar/Ar whole rock age of 10.6±0.2 Ma and a preliminary plagioclase age of 10.4±0.2 Ma (DeOreo, 2004)."
Mvaf,,Andesite and dacite flows (Miocene),"Massive to platy andesite, includes hornblende- and pyroxene-andesite flows and dacite flows. Locally includes andesite and dacite domes; in part may be Pliocene. May locally include trachybasalt and basalt flows. An andesite flow west of the map area in the Norden quadrangle gives an Ar/Ar hornblende age of 6.33± 0.25 Ma (written communication, C.D. Henry, 2004)."
Mvbf,,Basalt flows (Miocene),"Grey to black, aphyric to coarsely crystalline basalt flows. A basalt flow at Red Lake Peak in the Carson Pass quadrangle gives an Ar/Ar whole rock age of 6.75±0.15 Ma (DeOreo, 2004). May locally include andesite and trachyandesite flows."
Mvs,,Fluvial deposits (Miocene),"Well-stratified, clast-supported deposits composed of mafic to intermediate volcanic clasts in the Caples Lake and Carson Pass quadrangles. Includes interstratified coarse-grained fluvial and volcanic debris flow deposits at Castle Point in the Caples Lake quadrangle and volcanic lithic sandstones and cobble conglomerate-breccia at Elephants Back in the Carson Pass quadrangle."
Mi,,Intrusive rocks (Miocene),"Local dikes and intrusions of andesite, latite, basaltic andesite, basalt and rhyolite; in part may be Pliocene. Mia – andesite, basaltic andesite and latite; Mib – basalt and basaltic andesite; Mir – rhyolite. An Ar/Ar age of 6.32 Ma on hornblende is reported from a hornblende andesite intrusion in the Martis Peak quadrangle at Martis Peak (written communication, W.S. Wise, 2004). A basaltic andesite intrusion on the west side of Little Valley in the Marlette Lake quadrangle and a basalt dike west of Donner Lake in the Norden quadrangle, west of the map area, give Ar/Ar whole-rock ages of 13.9±0.9 Ma and 8.4±0.4 Ma respectively (written communication, C.D. Henry, 2004). Armin and others (1984) report a K-Ar age of 5.2±0.8 Ma on a hornblende andesite neck at Stevens Peak and a K-Ar age of 13.4±1.5 Ma on an andesite dome at Elephants Back in the Carson Pass quadrangle."
Mia,,Intrusive rocks (Miocene),"andesite, basaltic andesite and latite"
Mib,,Intrusive rocks (Miocene),basalt and basaltic andesite
Mir,,Intrusive rocks (Miocene),rhyolite
Mvg,,Glenbrook volcanic center (Miocene),"Porphyritic hornblende-sanidine latite in irregular-shaped intrusive masses and dikes, local vitric-crystal tuff and associated hornblende trachyte flows and vent fill in the Glenbrook quadrangle (Grose, 1985). Mvgi – latite intrusions; Mvgt – vitric-crystal tuff; Mvgf – trachyte flows and vent fill. Morton and others (1977) report a K-Ar age of 8.7±0.3 Ma."
Mvgi,,Glenbrook volcanic center (Miocene),latite intrusions
Mvgt,,Glenbrook volcanic center (Miocene),vitric-crystal tuff
Mvgf,,Glenbrook volcanic center (Miocene),trachyte flows and vent fill
Mvul,Upper lahar sequence of Harwood and Fisher (2002),Andesitic lahars (Miocene),Light- to dark-gray lahars composed primarily of hornblende andesite blocks mixed with basalt and dacite fragments.
Mvula,Upper lahar sequence of Harwood and Fisher (2002),Andesite flows (Miocene),"Light-gray weathering, dark-gray, fine-grained, porphyritic hornblende andesite flows."
Mvulp,Upper lahar sequence of Harwood and Fisher (2002),Pumiceous tuff (Miocene),"White to yellow-tan, hornblende-rich pumice lapilli air- fall tuff; pumice lapillae up to 2 cm in diameter mixed with generally minor amounts of dark-gray to brick-red scoria; massive to thick-bedded, locally graded layers."
Mvulr,Upper lahar sequence of Harwood and Fisher (2002),Rockslide-avalanche deposits (Miocene),"Mottled gray, tan, brick-red and yellow, nonstratified, heterolithologic chaotic mixture of huge volcanic blocks and matrix; blocks consist of intensely fractured and altered, aphanitic dacite(?), scattered blocks of andesite and andesitic lahar in a matrix of volcanic mudstone and ash. Forms a widespread debris blanket south and southwest of Squaw Valley."
Mvll,Lower lahar sequence of Harwood and Fisher (2002),Andesitic lahars (Miocene),"Gray to brick-red, blocky, massive locally flow- banded lahars composed of chaotic mixtures of andesitic fragmental debris in a volcaniclastic muddy matrix; minor interbedded volcanic conglomerate and sandstone; sparse andesite flows."
Mvlla,Lower lahar sequence of Harwood and Fisher (2002),Andesite flows (Miocene),"Light-gray weathering, dark-gray, fine-grained, porphyritic hornblende andesite flows. Harwood and Fisher (2002) report a K-Ar whole-rock age of 5.4±0.07 Ma on an andesite flow west of the map area in the Granite Chief quadrangle."
OMvr,,Rhyolite tuff (Oligocene and Miocene?),"Crystal-rich to crystal-poor, welded and non-welded rhyolite tuff from sources in central and western(?) Nevada. Includes the Valley Springs Formation, Lenihan Canyon Tuff and the Mickey Pass Tuff. Ar/Ar ages for the Lenihan Canyon Tuff (26.60±0.06 Ma) and the Mickey Pass Tuff (26.94±0.07 Ma) were obtained from samples collected at McClellan Peak in the Virgina City quadrangle, Nevada (written communication, C.D. Henry, 2004). Other isotopic ages determined for rhyolite tuffs exposed to the east and west of the map area range from 21.6 to 33.9 Ma (Harwood and Fisher, 2002; Stewart, 1999)."
Oc,,Conglomerate and breccia (Oligocene and/or older Tertiary),Conglomerate consisting of angular to rounded boulders of Tertiary volcanic rocks and pre-Tertiary metavolcanic and mafic plutonic rocks.
ap,,Aplite and pegmatite dikes (Cretaceous),Medium- to fine-grained; in places altered and iron-stained.
Kelg,Sierra Nevada Batholith,Echo Lake granodiorite (Cretaceous),"Very light-gray, medium- to coarse- grained, weakly porphyritic hornblende-biotite granodiorite; locally includes quartz monzonite. Commonly weathers to pale-orangish-gray grus. Characterized by small microcline phenocrysts 0.5 to 1.5 cm long and abundant flattened mafic inclusions. Mafic inclusions are common and are locally abundant near contacts. Similar to and probably correlative with the Freel Peak granodiorite. Armin and John (1983) report a K-Ar age of 91.7±0.8 Ma (hornblende) and 72.8±1.0 Ma (biotite) from a sample collected on the north side of Waterhouse Peak in the Freel Peak quadrangle. Intrudes the Keiths Dome quartz monzonite and is intruded by the Bryan Meadow granodiorite."
Kppg,Sierra Nevada Batholith,Phipps Pass granodiorite (Cretaceous),"Medium- to coarse-grained, equigranular hornblende-biotite granodiorite. Texturally similar to the more potassic granodiorite phases of the Bryan Meadow granodiorite."
Kbmg,Sierra Nevada Batholith,Bryan Meadow granodiorite (Cretaceous),"Light-gray, medium-grained locally porphyritic hornblende-biotite granodiorite typically containing about 5 percent subhedral and euhedral hornblende crystals as large as 1 cm, and similar amounts of biotite in a groundmass of feldspar and quartz. Intrudes the Echo Lake granodiorite, Burnside Lake adamellite, granodiorite of Freel Peak, Lovers Leap granodiorite, quartz diorite of Jobs Canyon, Keiths Dome quartz monzonite, and the Desolation Valley granodiorite. Armin and John (1983) report K-Ar ages of 89.3±2 and 89.6±2 Ma (biotite) for a sample collected in Horsethief Canyon in the Freel Peak quadrangle."
Kllg,Sierra Nevada Batholith,Lovers Leap granodiorite (Cretaceous),"Light-gray, fine- to medium-grained porphyritic hornblende-biotite granodiorite with abundant 10- to 15-mm-long poikilitic potassium feldspar phenocrysts and fairly abundant clots of fine-grained biotite and hornblende 3 to 10 mm in diameter. Intruded by the Wrights Lake granodiorite and Bryan Meadow granodiorite."
Kgag,Sierra Nevada Batholith,Glen Alpine granodiorite (Cretaceous),Hornblende-biotite granodiorite; foliated throughout; mafic inclusions commonly less than 16 mm. Hornblende crystals define a vertical lineation near the contacts.
Ktlg,Sierra Nevada Batholith,Tyler Lake granodiorite of Sabine (1992) (Cretaceous),"Medium-grained, equigranular granodiorite. Plagioclase forms equant or tabular euhedral to subhedral crystals 1 to 3 mm across. Biotite is the principal mafic mineral occurring as discrete grains or in small clusters. Intrudes the Pyramid Peak granite and the Desolation Valley granodiorite."
Kwlg,Sierra Nevada Batholith,Wrights Lake granodiorite (Cretaceous),"Medium- to coarse-grained hornblende- biotite granodiorite with poikilitic potassium feldspar; distinguished by euhedral hornblende 8 to 15 mm long. Randomly distributed mafic inclusions are common. A general planar orientation of hornblende and plagioclase defines a subtle foliation. Intrudes the Pyramid Peak granite, Camper Flat granodiorite, and the Lovers Leap granodiorite."
Kdlg,Sierra Nevada Batholith,Dicks Lake granodiorite (Cretaceous),Medium- to coarse-grained hornblende- biotite granodiorite; foliated and lineated subvertically near the contact. Intrudes the Camper Flat granodiorite and the quartz diorite of Azure Lake.
Krpa,Sierra Nevada Batholith,Alaskite at Rubicon Point (Cretaceous),"Medium- to coarse-grained alaskite. Consists of quartz, plagioclase, microcline, and biotite. Foliate structure indicates it is younger than the Phipps Pass granodiorite."
Krvg,Sierra Nevada Batholith,Rockbound Valley granodiorite (Cretaceous),Hornblende-biotite granodiorite; distinguished by the consistent and relatively fine grain size of the mafic minerals. Intrudes the Camper Flat granodiorite.
Kwpg,Sierra Nevada Batholith,Granodiorite of Waterhouse Peak (Cretaceous),"Dark-gray, fine-grained, equigranular hornblende-biotite granodiorite to quartz monzodiorite exposed on the northeast flank of Waterhouse Peak. Flattened diorite inclusions are locally abundant. Intrudes the Echo Lake granodiorite and the Bryan Meadow granodiorite."
